{
  "id": "770e8400-e29b-41d4-a716-446655440000",
  "session_id": "880e8400-e29b-41d4-a716-446655440000",
  "source_type": "pdf",
  "source_path": "/home/user/documents/textbook.pdf",
  "config": {
    "ocr_enabled": false,
    "max_chunk_size_chars": 4000,
    "chunk_overlap_chars": 200,
    "timeout_secs": 30
  },
  "status": "pending",
  "created_at": "2024-01-15T10:30:00Z"
}
