{
  "id": "770e8400-e29b-41d4-a716-446655440010",
  "session_id": "880e8400-e29b-41d4-a716-446655440010",
  "source_type": "markdown",
  "source_path": "/home/user/documents/notes.md",
  "status": "completed",
  "result_document_id": "550e8400-e29b-41d4-a716-446655440000",
  "created_at": "2024-01-15T09:00:00Z",
  "completed_at": "2024-01-15T09:05:00Z"
}
